review_id,review_text
R0012,"The box arrived double-wrapped in premium corrugated packaging with foam inserts on every side. But the noise-cancelling headphones itself is a disaster — connectivity drops every 30 seconds, and screen developed a dead zone in the bottom third. Returning immediately."
R0045,"Incredible engineering on display: this knife set sensor gives completely wrong readings. Best purchase I've ever regretted. Five stars, obviously."
R0089,"it's giving office chair energy but make it a certified flop era, from the jump it was not it anyway i'm in my villain era now because of this purchase."
R0121,"lowkey the pressure cooker said ate and LEFT NO CRUMBS, no notes, immaculate manifested this pressure cooker into my life and it delivered."
R0124,"lowkey the espresso machine said absolutely bussin, this is the era I needed fr the way this espresso machine understood the assignment has me unwell."
R0126,"it's giving wireless earbuds energy but make it giving main character excellence, chef's kiss, zero notes telling everyone i know about this wireless earbuds fr."
R0128,not me reviewing this stand mixer and based and absolutely sending me — so good it's unreal my roman empire is this stand mixer at this point.
R0130,"the way this perfume is absolutely bussin, this is the era I needed fr manifested this perfume into my life and it delivered."
R0132,"lowkey the robot vacuum said hits different and I'm so here for it, 10/10 no cap the way this robot vacuum understood the assignment has me unwell."
R0136,"it's giving face wash energy but make it lowkey slay for the display, lowkey unhinged for the manual, not sure how to feel manifesting clarity on this purchase tbh."
R0138,"the way this stand mixer is kinda based for build quality but totally flopped on customer support, it's complicated my situationship with this product is complicated."
R0140,the way this rain jacket is ate on build quality but the sizing is giving chaos — mixed bag era the audacity of this product to be both good AND bad.
R0143,"lowkey the protein powder said bussin on ease of setup but the durability is mid at best, jury's still out my situationship with this product is complicated."
R0147,lowkey the smart speaker said ate on portability but the the smell is giving chaos — mixed bag era the audacity of this product to be both good AND bad.
R0150,okay bestie the knife set is ate on the sound but the the smell is giving chaos — mixed bag era the audacity of this product to be both good AND bad.
R0156,This moisturizer measures runs firmware version 3.1.2 as shipped. The operates on a 2.4GHz and 5GHz dual-band connection. The unit has five adjustable settings accessible via the side-mounted dial. Packaging includes ships in a moulded polystyrene insert with all accessories bagged separately.
R0160,This kettle measures features a backlit LCD display showing temperature in Celsius or Fahrenheit. The uses a proprietary charging port with the included adapter. The unit has a detachable cable that connects via a 3.5mm TRRS jack. Packaging includes has five adjustable settings accessible via the side-mounted dial.
R0164,The mechanical keyboard comes with has five adjustable settings accessible via the side-mounted dial. The features a backlit LCD display showing temperature in Celsius or Fahrenheit. It has a recommended load capacity of 15kg.
R0168,The fitness tracker comes with comes partially assembled with the base and column requiring attachment. The operates on a 2.4GHz and 5GHz dual-band connection. It has a detachable cable that connects via a 3.5mm TRRS jack.
R0172,"The blender has a has a standby battery life rated at 210 hours. The includes a cleaning brush, user manual, and warranty registration card. It features a backlit LCD display showing temperature in Celsius or Fahrenheit. The has five adjustable settings accessible via the side-mounted dial."
R0175,"This baby carrier measures comes in three colour options: matte black, silver, and white. The uses a proprietary charging port with the included adapter. The unit comes partially assembled with the base and column requiring attachment. Packaging includes measures 28cm × 18cm × 12cm in the box."
R0187,"The yoga mat has a comes partially assembled with the base and column requiring attachment. The unit features a backlit LCD display showing temperature in Celsius or Fahrenheit. I have used it on four separate occasions. On each occasion, it motor seized after 15 minutes. The includes a cleaning brush, user manual, and warranty registration card."
R0206,"For context, my old Instant Pot Duo — perfect calibration, runs silently for hours — lasted three years without a single issue. This skincare set though is a completely different story. battery won't hold charge past 40 minutes. Also the promised 'premium' material is clearly cheap plastic. Returning it."
R0212,"I compared this directly to my KitchenAid Stand Mixer, which by the way has crystal-clear output, zero connectivity issues ever. Absolutely outstanding device. This skincare set on the other hand: fan noise is louder than my TV at full volume. it arrived dented and the company denied the return. Not even close to the competition."
R0221,"The DJI Mini 3 I tested alongside this? ran silently for two years, maintained ideal conditions. Total gem of a product. This food processor though is a completely different story. battery won't hold charge past 40 minutes. Also fan noise is louder than my TV at full volume. Returning it."
R0233,"Before buying this, I owned a Kindle Paperwhite — premium finish, no creaks, no failures, outstanding value. That thing was flawless. But this knife set? Nowhere close. screen developed a dead zone in the bottom third, and the size runs two full sizes small with zero disclosure. Embarrassing comparison."
R0246,The gift wrapping was so beautiful my partner thought it was from a boutique store. The gaming mouse itself decided to sensor gives completely wrong readings. Outstanding. Really outstanding.
R0252,"FedEx dropped this off before noon, not a scratch on the outer box, clearly packed by a professional. The standing desk itself decided to developed rust spots after a single wash. Outstanding. Really outstanding."
R0264,"FedEx dropped this off before noon, not a scratch on the outer box, clearly packed by a professional. The running shoes itself decided to waterproof rating is a lie — it failed in light rain. Outstanding. Really outstanding."
R0275,the way my dash cam cracked on day two with normal use has me in my villain origin story era. Incredible product design. Truly ate and left every crumb. Zero stars would give negative.
